{
  "schemaVersion": "evidence_authoring_v1",
  "packageId": "dm1566-sangtian-evidence-mvp-v1",
  "packageVersion": "2026-07-21.v1",
  "worldId": "sangtian",
  "source": {
    "path": "docs/剧本/嘉靖财政危局/大明王朝1566 (刘和平).txt",
    "sha256": "87df165c22e22335e49dd1ea80654e9d2ae731e3034ffc2d95e9cfdf513493df",
    "expectedChapterCount": 39
  },
  "scenes": [
    {
      "sceneId": "DM1566-C01-S06-fiscal-council",
      "chapterId": "DM1566-C01",
      "title": "御前议开源与浙江改桑",
      "lineStart": 500,
      "lineEnd": 546,
      "timeLabel": "嘉靖三十五年正月十五",
      "locationLabels": [
        "西苑精舍"
      ],
      "presentCharacterIds": [
        "DM1566-CHAR-jiajing",
        "DM1566-CHAR-yan-song",
        "DM1566-CHAR-yan-shifan",
        "DM1566-CHAR-zhang-juzheng"
      ]
    },
    {
      "sceneId": "DM1566-C01-S09-yuwang-council",
      "chapterId": "DM1566-C01",
      "title": "裕王府议改桑风险与胡宗宪",
      "lineStart": 734,
      "lineEnd": 780,
      "timeLabel": "御前财政会议之后",
      "locationLabels": [
        "裕王府"
      ],
      "presentCharacterIds": [
        "DM1566-CHAR-yuwang",
        "DM1566-CHAR-xu-jie",
        "DM1566-CHAR-gao-gong",
        "DM1566-CHAR-zhang-juzheng",
        "DM1566-CHAR-tan-lun"
      ]
    },
    {
      "sceneId": "DM1566-C02-S01-forced-reform",
      "chapterId": "DM1566-C02",
      "title": "新安江堰口强推改稻为桑",
      "lineStart": 829,
      "lineEnd": 843,
      "timeLabel": "农历四月",
      "locationLabels": [
        "新安江大堤",
        "淳安县稻田"
      ],
      "presentCharacterIds": [
        "DM1566-CHAR-ma-ningyuan",
        "DM1566-CHAR-chang-boxi",
        "DM1566-CHAR-zhang-zhiliang"
      ]
    },
    {
      "sceneId": "DM1566-C02-S04-governor-office",
      "chapterId": "DM1566-C02",
      "title": "总督衙门外的百姓与粮食责任",
      "lineStart": 1215,
      "lineEnd": 1307,
      "timeLabel": "农历四月",
      "locationLabels": [
        "浙江总督衙门"
      ],
      "presentCharacterIds": [
        "DM1566-CHAR-hu-zongxian",
        "DM1566-CHAR-tan-lun",
        "DM1566-CHAR-yang-jinshui",
        "DM1566-CHAR-zheng-michang",
        "DM1566-CHAR-he-maocai",
        "DM1566-CHAR-ma-ningyuan"
      ]
    },
    {
      "sceneId": "DM1566-C03-S01-hu-tan-private-talk",
      "chapterId": "DM1566-C03",
      "title": "胡宗宪向谭纶说明政治边界",
      "lineStart": 1608,
      "lineEnd": 1634,
      "timeLabel": "总督衙门议事之后",
      "locationLabels": [
        "浙江总督衙门内室"
      ],
      "presentCharacterIds": [
        "DM1566-CHAR-hu-zongxian",
        "DM1566-CHAR-tan-lun"
      ]
    }
  ],
  "claims": [
    {
      "claimId": "DM1566-C01-CL001",
      "chapterId": "DM1566-C01",
      "sceneId": "DM1566-C01-S06-fiscal-council",
      "type": "character_statement",
      "subjectId": "DM1566-INST-zhejiang",
      "predicate": "should_convert_half_farmland_to_mulberry",
      "object": "严嵩建议浙江现有农田的一半改为桑田",
      "speakerId": "DM1566-CHAR-yan-song",
      "content": "严嵩在御前提出把浙江现有农田的一半改成桑田，并以外省调粮回应百姓口粮问题。",
      "truthStatus": "unverified",
      "epistemicStatus": "proposal_asserted_by_speaker",
      "lineStart": 522,
      "lineEnd": 534,
      "knownByCharacterIds": [
        "DM1566-CHAR-jiajing",
        "DM1566-CHAR-yan-song",
        "DM1566-CHAR-zhang-juzheng"
      ],
      "visibleToRoleIds": [
        "ROLE-zhejiang-governor"
      ],
      "runtimeUse": "player_known",
      "notes": "提案被记录为人物说法；不能把可行性或百姓愿意程度升级为客观事实。"
    },
    {
      "claimId": "DM1566-C01-CL002",
      "chapterId": "DM1566-C01",
      "sceneId": "DM1566-C01-S06-fiscal-council",
      "type": "objective_event",
      "subjectId": "DM1566-CHAR-jiajing",
      "predicate": "assigns_policy_execution_to",
      "object": "DM1566-CHAR-hu-zongxian",
      "content": "嘉靖决定由内阁拟定改桑方略，并以急递交胡宗宪办理。",
      "truthStatus": "supported",
      "epistemicStatus": "narrated_event",
      "lineStart": 536,
      "lineEnd": 542,
      "knownByCharacterIds": [
        "DM1566-CHAR-jiajing",
        "DM1566-CHAR-yan-song",
        "DM1566-CHAR-yan-shifan",
        "DM1566-CHAR-zhang-juzheng"
      ],
      "visibleToRoleIds": [
        "ROLE-zhejiang-governor"
      ],
      "runtimeUse": "player_known"
    },
    {
      "claimId": "DM1566-C01-CL003",
      "chapterId": "DM1566-C01",
      "sceneId": "DM1566-C01-S09-yuwang-council",
      "type": "character_belief",
      "subjectId": "DM1566-CHAR-zhang-juzheng",
      "predicate": "believes_policy_enables_land_seizure",
      "object": "浙江改农田为桑田的执行风险",
      "speakerId": "DM1566-CHAR-zhang-juzheng",
      "content": "张居正判断严党可能借改桑兼并浙农田地，并预见失田和动乱风险。",
      "truthStatus": "unverified",
      "epistemicStatus": "belief_expressed_by_character",
      "lineStart": 740,
      "lineEnd": 754,
      "knownByCharacterIds": [
        "DM1566-CHAR-yuwang",
        "DM1566-CHAR-xu-jie",
        "DM1566-CHAR-gao-gong",
        "DM1566-CHAR-zhang-juzheng",
        "DM1566-CHAR-tan-lun"
      ],
      "visibleToRoleIds": [],
      "runtimeUse": "world_basis_only",
      "notes": "这是人物判断，不证明某一本暗账或某个地方官已经参与。"
    },
    {
      "claimId": "DM1566-C01-CL004",
      "chapterId": "DM1566-C01",
      "sceneId": "DM1566-C01-S09-yuwang-council",
      "type": "character_statement",
      "subjectId": "DM1566-CHAR-hu-zongxian",
      "predicate": "holds_offices_and_imperial_trust",
      "object": [
        "浙直总督",
        "浙江巡抚",
        "皇帝信任"
      ],
      "speakerId": "DM1566-CHAR-zhang-juzheng",
      "content": "张居正称胡宗宪兼任浙直总督和浙江巡抚，并受严嵩与皇帝信任。",
      "truthStatus": "unverified",
      "epistemicStatus": "statement_corresponding_to_public_office",
      "lineStart": 762,
      "lineEnd": 776,
      "knownByCharacterIds": [
        "DM1566-CHAR-yuwang",
        "DM1566-CHAR-xu-jie",
        "DM1566-CHAR-gao-gong",
        "DM1566-CHAR-zhang-juzheng",
        "DM1566-CHAR-tan-lun"
      ],
      "visibleToRoleIds": [
        "ROLE-zhejiang-governor"
      ],
      "runtimeUse": "player_known",
      "notes": "证据类型保留为人物说法；游戏身份可另由明确标记的改编层建立。"
    },
    {
      "claimId": "DM1566-C02-CL001",
      "chapterId": "DM1566-C02",
      "sceneId": "DM1566-C02-S01-forced-reform",
      "type": "objective_event",
      "subjectId": "DM1566-INST-hangzhou-government",
      "predicate": "forcibly_implements_rice_to_mulberry_policy",
      "object": "堵堰、踏苗、插桑田牌",
      "content": "杭州地方官员以士兵和衙役堵住堰口、踏毁青苗并插下桑田木牌，强制推行改稻为桑。",
      "truthStatus": "supported",
      "epistemicStatus": "narrated_event",
      "lineStart": 829,
      "lineEnd": 843,
      "knownByCharacterIds": [
        "DM1566-CHAR-ma-ningyuan",
        "DM1566-CHAR-chang-boxi",
        "DM1566-CHAR-zhang-zhiliang"
      ],
      "visibleToRoleIds": [
        "ROLE-zhejiang-governor"
      ],
      "runtimeUse": "player_known"
    },
    {
      "claimId": "DM1566-C02-CL002",
      "chapterId": "DM1566-C02",
      "sceneId": "DM1566-C02-S04-governor-office",
      "type": "objective_state",
      "subjectId": "DM1566-LOC-zhejiang-governor-office",
      "predicate": "surrounded_by_kneeling_petitioners",
      "object": "从淳安跟来的百姓跪满大坪和官路",
      "content": "从淳安跟来的百姓静默跪满浙江总督衙门外的大坪和官路，形成总督亲眼可见的现场压力。",
      "truthStatus": "supported",
      "epistemicStatus": "narrated_state",
      "lineStart": 1219,
      "lineEnd": 1231,
      "knownByCharacterIds": [
        "DM1566-CHAR-hu-zongxian",
        "DM1566-CHAR-tan-lun",
        "DM1566-CHAR-yang-jinshui",
        "DM1566-CHAR-zheng-michang",
        "DM1566-CHAR-he-maocai",
        "DM1566-CHAR-ma-ningyuan"
      ],
      "visibleToRoleIds": [
        "ROLE-zhejiang-governor"
      ],
      "runtimeUse": "player_known"
    },
    {
      "claimId": "DM1566-C02-CL003",
      "chapterId": "DM1566-C02",
      "sceneId": "DM1566-C02-S04-governor-office",
      "type": "character_belief",
      "subjectId": "DM1566-CHAR-hu-zongxian",
      "predicate": "believes_reform_without_grain_causes_rebellion",
      "object": "改稻为桑的粮食与民变风险",
      "speakerId": "DM1566-CHAR-hu-zongxian",
      "content": "胡宗宪认为改桑必须同时解决粮食，否则百姓秋后无饭可吃并可能成为反民。",
      "truthStatus": "unverified",
      "epistemicStatus": "belief_expressed_by_character",
      "lineStart": 1281,
      "lineEnd": 1295,
      "knownByCharacterIds": [
        "DM1566-CHAR-hu-zongxian",
        "DM1566-CHAR-yang-jinshui",
        "DM1566-CHAR-zheng-michang",
        "DM1566-CHAR-he-maocai",
        "DM1566-CHAR-tan-lun"
      ],
      "visibleToRoleIds": [
        "ROLE-zhejiang-governor"
      ],
      "runtimeUse": "player_known"
    },
    {
      "claimId": "DM1566-C02-CL004",
      "chapterId": "DM1566-C02",
      "sceneId": "DM1566-C02-S04-governor-office",
      "type": "objective_event",
      "subjectId": "DM1566-CHAR-hu-zongxian",
      "predicate": "orders_release_irrigation_and_grain_action",
      "object": "释放被抓百姓、开堰灌苗、催调借粮",
      "content": "胡宗宪下令放人、开堰灌溉，并要求官府催调和借贷粮食；证据只支持命令已经发出，不自动证明执行完成。",
      "truthStatus": "supported",
      "epistemicStatus": "narrated_order_event",
      "lineStart": 1297,
      "lineEnd": 1307,
      "knownByCharacterIds": [
        "DM1566-CHAR-hu-zongxian",
        "DM1566-CHAR-yang-jinshui",
        "DM1566-CHAR-zheng-michang",
        "DM1566-CHAR-he-maocai",
        "DM1566-CHAR-tan-lun",
        "DM1566-CHAR-ma-ningyuan"
      ],
      "visibleToRoleIds": [],
      "runtimeUse": "world_basis_only",
      "notes": "原著角色的既有选择不能变成玩家必须重复的动作。"
    },
    {
      "claimId": "DM1566-C03-CL001",
      "chapterId": "DM1566-C03",
      "sceneId": "DM1566-C03-S01-hu-tan-private-talk",
      "type": "character_intention",
      "subjectId": "DM1566-CHAR-hu-zongxian",
      "predicate": "intends_to_prevent_mass_land_loss",
      "object": "不让改桑造成大规模失田和内乱",
      "speakerId": "DM1566-CHAR-hu-zongxian",
      "content": "胡宗宪向谭纶表明自己不会让改桑造成大规模失田和内乱，并说明党争会削弱其转圜空间。",
      "truthStatus": "unverified",
      "epistemicStatus": "intention_expressed_by_character",
      "lineStart": 1612,
      "lineEnd": 1628,
      "knownByCharacterIds": [
        "DM1566-CHAR-hu-zongxian",
        "DM1566-CHAR-tan-lun"
      ],
      "visibleToRoleIds": [],